target_id,mensagem_id,message,target_message,parent_message,label_original,classificacao,justificativa,assunto
18,19,"\""na realidade homem já não é obrigado a assumir nada\"".  \""o homem mete o pé 99% das vezes.\""\n\nNão é bem por aí. O número de nascimentos ultrapassa os 2.5 milhões por ano enquanto o número de registro sem o nome do pai é de uns 100 mil por ano. Não vou lembrar os números, mas as taxas de prisões por denúncias por não pagar pensão é bem maior que por vários outros crimes.","A paternidade deveria ser considerada nas discussões sobre o aborto e o homem também deveria ter o direito de \""abortar\"" (não criar o filho que uma mulher decidiu continuar a gravidez) caso as mulheres também pudessem abortar.","O zé que respondi basicamente disse\n\""Beleza! Pode liberar o aborto, mas também vai ter que tirar a obrigação dos homens de assumir os filhos!!! Quero ver agora, ngm vai querer aborto com esse ultimato do homens\"".\n\nMeu ponto é que todos que são a favor do aborto sabem que na realidade homem já não é obrigado a assumir nada. O homem sempre pode meter o pé, e nas famílias onde realmente se fariam aborto, e não o fazem por ser ilegal e caro (pq os ricos tem várias maneiras de abortar escondido), o homem mete o pé 99% das vezes. Aí ainda vem idiotas concordar e comentar \""verdade, não devemos ser obrigados a pagar pensão TB!!\"" A pensão: 300 reais mensais. \n\nNão sei se consigo ser mais didático que isso, nem se faria alguma diferença. Vcs fingirem não entender que pras mulheres o buraco està muito mais embaixo que pra gente, e a violência que é a criminalização do aborto para as mulheres pobres, que é isso, as ricas não só tem condições p criar quantas penca de filho tivesse, mas ainda assim pode viajar pra fazer aborto em lugar legalizado, sem a justiça poder dar um pio",Concorda,CONCORDA,"A mensagem atual, ao refutar a ideia de que homens não assumem responsabilidades parentais, indiretamente reforça a necessidade de discutir a paternidade no contexto do aborto, alinhando-se com a premissa da mensagem de referência. O autor da mensagem atual defende que os homens são, sim, obrigados a assumir responsabilidades, o que fortalece o argumento de que, se a mulher tem o direito de ""abortar"" a gravidez, o homem também deveria ter o direito de ""abortar"" a paternidade.",aborto
18,20,"A maioria dos abandonos paternos é com pai registrado, até porque é direito da criança ter seus pais registrados. Se a mãe for sozinha no cartório, ela ainda tem que registrar o nome do pai. Hoje, se alguém quiser registrar sem nome do pai, o ministério público baixa diligências à polícia para investigar a paternidade.\nMas não é sobre registro. É sobre abandono afetivo, sobre separar da mãe e por tabela separar dos filhos e pagar merreca em pensão (qnd paga) pelo \""deslize\"". Se a mulher pudesse ao invés de abortar, se livrar, totalmente dentro do politicamente correto e socialmente aceito, da gravidez/filho indesejado pagando 200, 300 conto por mês como os homens fazem, elas não iriam lutar pelo direito de aborto. OBS: sei que tem mulher contra o aborto, estou me referindo às mulheres conscientes que entendem do assunto.","A paternidade deveria ser considerada nas discussões sobre o aborto e o homem também deveria ter o direito de \""abortar\"" (não criar o filho que uma mulher decidiu continuar a gravidez) caso as mulheres também pudessem abortar.","\""na realidade homem já não é obrigado a assumir nada\"".  \""o homem mete o pé 99% das vezes.\""\n\nNão é bem por aí. O número de nascimentos ultrapassa os 2.5 milhões por ano enquanto o número de registro sem o nome do pai é de uns 100 mil por ano. Não vou lembrar os números, mas as taxas de prisões por denúncias por não pagar pensão é bem maior que por vários outros crimes.",Discorda,DISCORDA,"A mensagem atual, embora não responda diretamente à mensagem de referência, continua a argumentação de Amy_Krause, que discorda da premissa da mensagem de referência. Ela argumenta que os homens já ""abandonam"" os filhos de diversas formas, inclusive financeiramente, e que a proposta da mensagem de referência não é uma solução equitativa para as mulheres.",aborto
18,21,"Tá indo pra um rumo totalmente diferente do comentário inicial. A questão é que em um cenário onde o aborto é legalizado a mulher passa a ter o poder de decidir se o homem vai ser pai em caso de gravidez indesejada. O problema é que mais uma vez o Estado deixa a balança da \""igualdade\"" pesar em favor das mulheres. A gente já vive em um mundo que prioriza a utilização dos recursos públicos com as mulheres.","A paternidade deveria ser considerada nas discussões sobre o aborto e o homem também deveria ter o direito de \""abortar\"" (não criar o filho que uma mulher decidiu continuar a gravidez) caso as mulheres também pudessem abortar.","A maioria dos abandonos paternos é com pai registrado, até porque é direito da criança ter seus pais registrados. Se a mãe for sozinha no cartório, ela ainda tem que registrar o nome do pai. Hoje, se alguém quiser registrar sem nome do pai, o ministério público baixa diligências à polícia para investigar a paternidade.\nMas não é sobre registro. É sobre abandono afetivo, sobre separar da mãe e por tabela separar dos filhos e pagar merreca em pensão (qnd paga) pelo \""deslize\"". Se a mulher pudesse ao invés de abortar, se livrar, totalmente dentro do politicamente correto e socialmente aceito, da gravidez/filho indesejado pagando 200, 300 conto por mês como os homens fazem, elas não iriam lutar pelo direito de aborto. OBS: sei que tem mulher contra o aborto, estou me referindo às mulheres conscientes que entendem do assunto.",Concorda,CONCORDA,"A mensagem atual reforça a ideia da mensagem de referência de que o homem deveria ter o direito de ""abortar"" (não criar o filho) em caso de gravidez indesejada, argumentando que a legalização do aborto dá à mulher um poder de decisão unilateral que desequilibra a ""igualdade"" e prioriza os recursos públicos para as mulheres.",aborto
18,22,"O bizarro em um contexto onde o aborto seja permitido é que o homem seja obrigado a pagar pensão, e explico isso utilizando argumentos éticos e lógicos.\n\nOra, se uma mulher pode abortar, ter ou não ter o filho passa a ser uma escolha EXCLUSIVAMENTE dela. Nesse sentido, não é ético que ela, ou o Estado, vincule o pai (ou o suposto pai) por uma escolha que não foi feita por ele - afinal, a criança só veio a nascer graças a escolha da mulher. Obrigar o homem a ficar vinculado à escolha da mulher fere de morte qualquer princípio que visa proteger a dignidade humana.\n\nEm um contexto onde o aborto é permitido, só é justificável o pagamento de pensão quando os dois decidem ter a criança mas, por qualquer seja o motivo, o casal se divorcie. Nesse caso é justo que aquele que não ficou com a guarda da criança ajude financeiramente na criação dela.\n\nE aqui é importante destacar que a pensão NUNCA deveria ser ajuda financeira para aquele que ficou com aguarda. Deveria ser aquele que não ficou com a guarda assumindo alguma ou algumas obrigações, como pagar a mensalidade da escola, o plano de saúde da criança, se comprometer a comprar um valor \""x\"" de roupas anualmente...\n\nEm um contexto onde o aborto não seja legalizado, como a mulher não tem a escolha se vai ter, ou não ter a criança, é mais do certo que o Estado obrigue o homem a arcar com a paternidade. Esse é o modelo que defendo - que por sua vez, é o modelo atual do Brasil.\n\nO modelo que falei acima, de não haver obrigatoriedade de pensão, só é justificável do ponto de vista ético e moral em um contexto onde o aborto seja permitodp.","A paternidade deveria ser considerada nas discussões sobre o aborto e o homem também deveria ter o direito de \""abortar\"" (não criar o filho que uma mulher decidiu continuar a gravidez) caso as mulheres também pudessem abortar.","Tmnc cara. O tanto de \""pai\"" que já usufruem desse direito de meter o pé. É nessas que fica evidente como o pessoal no reddit é classe média e totalmente alheio às realidades. Tantos homens que já abandonam os filhos e se esquivam de pagar pensão. Só na classe de vcs que o padrão é que pai de criança indesejada \""tem que assumir\"" e realmente paga pensão certinho e substancial",Concorda,CONCORDA,"A mensagem atual reitera e expande o argumento da mensagem de referência, defendendo que, se o aborto for legalizado para mulheres, os homens deveriam ter o direito de ""abortar"" a paternidade (não pagar pensão) em casos de gravidez indesejada, alinhando-se completamente com a ideia original.",aborto
18,23,"A descriminalização do aborto não é a banalização do aborto. O aborto continuará sendo um procedimento cirúrgico de risco. Não é uma mera \""escolha\"", uma decisão qualquer que a mulher fará a cada 15 dias. Aborto seria um direito da mulher, e tanto escolher abortar ou não abortar não deve causar mais consequências do que as inerentes a ação. \n\nO direito a pensão já é da criança. Já é pra ser como vc \""sugeriu\"", de divisão de despesas. Pensão para ex-cônjuge é outra coisa. Considerando que o direito à ter pai e a ser sustentada pelos genitores é da criança, a decisão da mãe de não abortar, ainda que dá concepção acidental, jamais iria afetar o direito do nascituro ao pai e à pensão alimentícia.","A paternidade deveria ser considerada nas discussões sobre o aborto e o homem também deveria ter o direito de \""abortar\"" (não criar o filho que uma mulher decidiu continuar a gravidez) caso as mulheres também pudessem abortar.","O bizarro em um contexto onde o aborto seja permitido é que o homem seja obrigado a pagar pensão, e explico isso utilizando argumentos éticos e lógicos.\n\nOra, se uma mulher pode abortar, ter ou não ter o filho passa a ser uma escolha EXCLUSIVAMENTE dela. Nesse sentido, não é ético que ela, ou o Estado, vincule o pai (ou o suposto pai) por uma escolha que não foi feita por ele - afinal, a criança só veio a nascer graças a escolha da mulher. Obrigar o homem a ficar vinculado à escolha da mulher fere de morte qualquer princípio que visa proteger a dignidade humana.\n\nEm um contexto onde o aborto é permitido, só é justificável o pagamento de pensão quando os dois decidem ter a criança mas, por qualquer seja o motivo, o casal se divorcie. Nesse caso é justo que aquele que não ficou com a guarda da criança ajude financeiramente na criação dela.\n\nE aqui é importante destacar que a pensão NUNCA deveria ser ajuda financeira para aquele que ficou com aguarda. Deveria ser aquele que não ficou com a guarda assumindo alguma ou algumas obrigações, como pagar a mensalidade da escola, o plano de saúde da criança, se comprometer a comprar um valor \""x\"" de roupas anualmente...\n\nEm um contexto onde o aborto não seja legalizado, como a mulher não tem a escolha se vai ter, ou não ter a criança, é mais do certo que o Estado obrigue o homem a arcar com a paternidade. Esse é o modelo que defendo - que por sua vez, é o modelo atual do Brasil.\n\nO modelo que falei acima, de não haver obrigatoriedade de pensão, só é justificável do ponto de vista ético e moral em um contexto onde o aborto seja permitodp.",Discorda,DISCORDA,"A mensagem atual discorda da premissa da mensagem de referência ao argumentar que a descriminalização do aborto não banaliza a decisão e que o direito à pensão é da criança, não sendo afetado pela escolha da mãe de não abortar. Ela refuta a ideia de que a escolha da mulher de levar a gravidez adiante deveria desobrigar o pai da responsabilidade financeira.",aborto
19,2,"Não. É permitido em casos de alegação de estupro, atualmente não existe obrigação de comunicação à polícia, inclusive o hospital é proíbido de comunicar e gerar investigação policial. Ou seja, se a mulher for lá e mentir que for estuprada pode fazer aborto sem nenhuma consequência.","Hoje em dia o aborto é permitido em casos de estupro, logo o comentário da Rosa Weber de que a maternidade é uma escolha é válido dado que ele já é permitido nesses cenários",E o aborto já é permitido em casos de estupro.,Discorda,DISCORDA,"A mensagem atual discorda da mensagem de referência ao refutar a premissa de que o aborto é permitido em casos de estupro de forma irrestrita, apontando a possibilidade de alegação falsa e a falta de investigação policial como um problema.",aborto
19,3,"Poisé, acho a legislação perfeita a respeito disso.","Hoje em dia o aborto é permitido em casos de estupro, logo o comentário da Rosa Weber de que a maternidade é uma escolha é válido dado que ele já é permitido nesses cenários",E o aborto já é permitido em casos de estupro.,Concorda,CONCORDA,"A mensagem atual expressa concordância com a legislação existente sobre o aborto em casos de estupro, o que alinha com a premissa da mensagem de referência de que a maternidade é uma escolha, dado que o aborto já é permitido nesses cenários.",aborto
19,4,"Mas os conservadores cornos já querem proibir até nesses casos. Até se uma criança for declarada com doença rara, que vai trazer risco de morte para a mãe, e com chance de nascer morto, eles querem proibir aborto.","Hoje em dia o aborto é permitido em casos de estupro, logo o comentário da Rosa Weber de que a maternidade é uma escolha é válido dado que ele já é permitido nesses cenários",E o aborto já é permitido em casos de estupro.,Concorda,CONCORDA,"A mensagem atual, ao criticar a intenção dos conservadores de proibir o aborto mesmo em casos já previstos por lei (como estupro e risco de vida), reforça implicitamente a ideia da mensagem de referência de que a maternidade é uma escolha, especialmente nos cenários onde o aborto já é legalmente permitido.",aborto
19,5,Falácia do espantalho...\n\n![gif](giphy|hLrw0RzLspCXTYdoLZ|downsized),"Hoje em dia o aborto é permitido em casos de estupro, logo o comentário da Rosa Weber de que a maternidade é uma escolha é válido dado que ele já é permitido nesses cenários","Mas os conservadores cornos já querem proibir até nesses casos. Até se uma criança for declarada com doença rara, que vai trazer risco de morte para a mãe, e com chance de nascer morto, eles querem proibir aborto.",Outros,OUTROS,"A mensagem atual não se posiciona diretamente sobre a mensagem de referência, mas sim critica a mensagem anterior [4] por supostamente usar uma ""falácia do espantalho"", sem expressar concordância ou discordância com o ponto original.",aborto
19,6,"Se nasce, quer dizer que não representa risco. Se então morreu, triste e que seja enterrado. De resto, vc quer usar 0,0001% dos casos para justificar assassinato de inocentes.","Hoje em dia o aborto é permitido em casos de estupro, logo o comentário da Rosa Weber de que a maternidade é uma escolha é válido dado que ele já é permitido nesses cenários","Mas os conservadores cornos já querem proibir até nesses casos. Até se uma criança for declarada com doença rara, que vai trazer risco de morte para a mãe, e com chance de nascer morto, eles querem proibir aborto.",Discorda,DISCORDA,"A mensagem atual, embora responda a uma mensagem que concorda com a referência, expressa um posicionamento contrário à permissão do aborto, mesmo em casos extremos, o que se alinha com uma discordância fundamental em relação à ideia de que a maternidade é uma escolha justificada pela legislação atual. O uso da expressão ""assassinato de inocentes"" reforça a oposição ao aborto.",aborto
19,7,"Defina risco. \n\nUma criança, por exemplo, com osso de vidro nasce normalmente. Crianças com microcefalia também nascem normalmente. Tem muitos outros problemas de saúde que a criança nasce normalmente, incluindo autismo severo e deficiências cognitivas. \n\nSabe o que são essas crianças? Herança.","Hoje em dia o aborto é permitido em casos de estupro, logo o comentário da Rosa Weber de que a maternidade é uma escolha é válido dado que ele já é permitido nesses cenários","Se nasce, quer dizer que não representa risco. Se então morreu, triste e que seja enterrado. De resto, vc quer usar 0,0001% dos casos para justificar assassinato de inocentes.",Outros,DISCORDA,"A mensagem atual, ao questionar a definição de ""risco"" e listar condições que, apesar de graves, resultam em nascimentos ""normais"", implicitamente refuta a ideia de que a maternidade é uma escolha baseada em condições de saúde do feto, defendendo a vida independentemente dessas condições. Isso se alinha com uma postura contrária à permissão do aborto, discordando da premissa da mensagem de referência.",aborto
19,8,"E? Qual risco apresentam para a mãe? Não refutou nada do que falei, apenas provou.","Hoje em dia o aborto é permitido em casos de estupro, logo o comentário da Rosa Weber de que a maternidade é uma escolha é válido dado que ele já é permitido nesses cenários","Defina risco. \n\nUma criança, por exemplo, com osso de vidro nasce normalmente. Crianças com microcefalia também nascem normalmente. Tem muitos outros problemas de saúde que a criança nasce normalmente, incluindo autismo severo e deficiências cognitivas. \n\nSabe o que são essas crianças? Herança.",Discorda,DISCORDA,"A mensagem atual, ao questionar ""Qual risco apresentam para a mãe?"", reforça a posição de Jamie_Cunningham de que a permissão do aborto em casos de estupro não valida a ideia de que a maternidade é uma escolha, especialmente quando se trata de riscos à mãe, que não foram o foco da mensagem de referência. A mensagem atual mantém a linha de discordância com a mensagem de referência, que é a raiz da conversa.",aborto
19,9,"Todos. São 100% dependentes, ao ponto de não saber se limpar ou respirar sem ajuda de aparelhos. A mae sempre tem que se dedicar pra eles, parar de viver pra cuidar de um saco de carne que vai virar herança pra algum familiar depois. Isso não é vida e também não é justo. Você sacrifica uma pessoa, um humano capaz, de uns 20 anos mais ou menos, em troca de uma casca oca por pelo menos 30 anos. É pior que dar prisão perpétua pra essa mãe, porque além da dedicação ela tem que amar aquela criança.","Hoje em dia o aborto é permitido em casos de estupro, logo o comentário da Rosa Weber de que a maternidade é uma escolha é válido dado que ele já é permitido nesses cenários","E? Qual risco apresentam para a mãe? Não refutou nada do que falei, apenas provou.",Concorda,DISCORDA,"A mensagem atual, ao descrever a maternidade de uma criança com deficiência como um ""saco de carne"" e ""casca oca"" que ""sacrifica"" a mãe, contradiz a ideia de que a maternidade é uma escolha válida, especialmente em cenários onde o aborto é permitido. Ela argumenta que, mesmo com a permissão legal, a maternidade pode ser uma imposição cruel, o que se opõe à premissa da mensagem de referência.",aborto
19,10,"Exatamente, quando vc vê as mães que tem filhos com microcefalia é horrível. Pq só come e caga. Não cresce não se desenvolve. Nada, só vegeta o dia inteiro. Mas precisam de muitas intervenções 24 horas por dia.  E è sempre a mãe que tem que ficar em casa cuidado","Hoje em dia o aborto é permitido em casos de estupro, logo o comentário da Rosa Weber de que a maternidade é uma escolha é válido dado que ele já é permitido nesses cenários","Todos. São 100% dependentes, ao ponto de não saber se limpar ou respirar sem ajuda de aparelhos. A mae sempre tem que se dedicar pra eles, parar de viver pra cuidar de um saco de carne que vai virar herança pra algum familiar depois. Isso não é vida e também não é justo. Você sacrifica uma pessoa, um humano capaz, de uns 20 anos mais ou menos, em troca de uma casca oca por pelo menos 30 anos. É pior que dar prisão perpétua pra essa mãe, porque além da dedicação ela tem que amar aquela criança.",Concorda,CONCORDA,"A mensagem atual, ao descrever a dificuldade de cuidar de crianças com microcefalia e a dedicação exigida da mãe, reforça a ideia de que a maternidade deve ser uma escolha, alinhando-se indiretamente com o argumento da mensagem de referência sobre a validade do comentário de Rosa Weber.",aborto
19,11,Quando come ainda é vantagem.,"Hoje em dia o aborto é permitido em casos de estupro, logo o comentário da Rosa Weber de que a maternidade é uma escolha é válido dado que ele já é permitido nesses cenários","Exatamente, quando vc vê as mães que tem filhos com microcefalia é horrível. Pq só come e caga. Não cresce não se desenvolve. Nada, só vegeta o dia inteiro. Mas precisam de muitas intervenções 24 horas por dia.  E è sempre a mãe que tem que ficar em casa cuidado",Concorda,OUTROS,"A mensagem atual é um comentário irônico que se refere à mensagem anterior de Susan_Carroll, mas não se posiciona diretamente em relação à mensagem de referência sobre a validade do comentário de Rosa Weber ou a permissão do aborto em casos de estupro.",aborto
19,12,"Meu Deus... que coisas horríveis perduram tua mente... não sei mais oq dizer se não procure salvação, ó que alma sofrida tu tens.","Hoje em dia o aborto é permitido em casos de estupro, logo o comentário da Rosa Weber de que a maternidade é uma escolha é válido dado que ele já é permitido nesses cenários","Todos. São 100% dependentes, ao ponto de não saber se limpar ou respirar sem ajuda de aparelhos. A mae sempre tem que se dedicar pra eles, parar de viver pra cuidar de um saco de carne que vai virar herança pra algum familiar depois. Isso não é vida e também não é justo. Você sacrifica uma pessoa, um humano capaz, de uns 20 anos mais ou menos, em troca de uma casca oca por pelo menos 30 anos. É pior que dar prisão perpétua pra essa mãe, porque além da dedicação ela tem que amar aquela criança.",Outros,OUTROS,"A mensagem atual não se posiciona diretamente sobre a mensagem de referência, mas sim expressa choque e repulsa em relação ao conteúdo da mensagem anterior (mensagem [9]), que descreve a dependência de crianças com deficiência. É um comentário de cunho pessoal e emocional, sem relação com a mensagem de referência.",aborto
19,13,"Ja fui salvo, 3x pra ser exato. Obrigado. E você procure estudo, talvez um pouco de bom senso e amor ao próximo. Boa sorte.","Hoje em dia o aborto é permitido em casos de estupro, logo o comentário da Rosa Weber de que a maternidade é uma escolha é válido dado que ele já é permitido nesses cenários","Meu Deus... que coisas horríveis perduram tua mente... não sei mais oq dizer se não procure salvação, ó que alma sofrida tu tens.",Outros,OUTROS,"A mensagem atual não se posiciona sobre a mensagem de referência, mas sim responde a um comentário anterior que a criticava pessoalmente, desviando do tema principal da conversa.",aborto
19,14,"Deviam liberar logo esterilização pra esquerdistas. Assim eles podem funhanhar a vontade, mas não deixarão herdeiros pra continuar ferrando a humanidade depois. Quer prazer sem responsabilidade? Então não libera aborto só quando eles tem vontade não, esteliriza direto. Não quero gastar trilhões em impostos sustentando aborto de riquinho no SUS não","Hoje em dia o aborto é permitido em casos de estupro, logo o comentário da Rosa Weber de que a maternidade é uma escolha é válido dado que ele já é permitido nesses cenários","Ja fui salvo, 3x pra ser exato. Obrigado. E você procure estudo, talvez um pouco de bom senso e amor ao próximo. Boa sorte.",Discorda,DISCORDA,"A mensagem atual, embora não se refira diretamente à mensagem de referência, expressa uma visão radicalmente contrária à permissão do aborto, defendendo a esterilização de ""esquerdistas"" para evitar que tenham filhos e criticando o uso de impostos para sustentar abortos. Isso se opõe à ideia de que a maternidade é uma escolha e que o aborto deve ser permitido em certos cenários.",aborto
19,15,"É liberado vasectomia e ligação de trompas a partir dos 21 anos. Rico já aborta independente de ter sus ou não. Mas tem razão, melhor botar mais uma vítima da sociedade no mundo. Todos esses problemas são ligados à falta de educação brasileira. \n\nAliás, pobre também. Você se surpreenderia como é fácil conseguir um remedinho com 400 mangos na mão.","Hoje em dia o aborto é permitido em casos de estupro, logo o comentário da Rosa Weber de que a maternidade é uma escolha é válido dado que ele já é permitido nesses cenários","Deviam liberar logo esterilização pra esquerdistas. Assim eles podem funhanhar a vontade, mas não deixarão herdeiros pra continuar ferrando a humanidade depois. Quer prazer sem responsabilidade? Então não libera aborto só quando eles tem vontade não, esteliriza direto. Não quero gastar trilhões em impostos sustentando aborto de riquinho no SUS não",Outros,OUTROS,"A mensagem atual não se posiciona diretamente sobre a validade do comentário da Rosa Weber ou sobre a permissão do aborto em casos de estupro. Em vez disso, ela responde a um comentário anterior sobre esterilização e aborto de ricos e pobres, desviando do tema central da mensagem de referência.",aborto
