target_id,mensagem_id,message,target_message,parent_message,label_original,classificacao,justificativa,assunto
1,2,"E olha que aqui tá cheio de liberais no sub, mesmo assim muitos defendem continuar esse sistema que não funciona, vai entender... brasileiro médio é conservador nos costumes","Eu acho que a direita está sendo hipócrita ao defender a redução do Estado e as liberdades individuais, mas ao mesmo tempo querer que o Estado controle o que as pessoas podem ou não consumir. Isso é uma incoerência total!\n\nAcredito que a luta contra as drogas deve ser focada na educação, conscientização e saúde, e não na repressão policial. A guerra contra as drogas é uma guerra perdida, que só serve para lotar as cadeias, consumir dinheiro e vidas. Em vez de perseguir quem cultiva uma plantinha, a polícia deveria se concentrar em prender ladrões e assassinos, que são os verdadeiros problemas da sociedade.","Incoerência da direita: pregam menos Estado, liberdades individuais, etc. etc. Mas daí querem o Estado malvadão controlando o que indivíduos podem ou não consumir.\n\n# Cadê a defesa das liberdades individuais??!\n\n# \n\nA luta contra as drogas deve ser questão de educação, conscientização, saúde... e não questão do Estado e muito menos da polícia. A guerra da polícia contra as drogas é uma guerra perdida, só lota as cadeias, usa a força policial à toa, consome muito dinheiro e vidas...\n\nGrande parte da sociedade não liga pra isso, há outras prioridades, crimes graves. Deixem a polícia prender ladrões, assassinos... e não perder tempo com quem está cultivando uma plantinha.",Concorda,CONCORDA,"A mensagem atual concorda com a crítica da mensagem de referência sobre a hipocrisia de liberais que defendem a redução do Estado, mas apoiam o controle estatal sobre o consumo, reforçando a ideia de que o sistema atual não funciona.",drogas
1,3,"Daí dizem que defender o controle do Estado na vida das pessoas é coisa de esquerdista... Mas se for o controle com base no meu moralismo, daí pode. 😂","Eu acho que a direita está sendo hipócrita ao defender a redução do Estado e as liberdades individuais, mas ao mesmo tempo querer que o Estado controle o que as pessoas podem ou não consumir. Isso é uma incoerência total!\n\nAcredito que a luta contra as drogas deve ser focada na educação, conscientização e saúde, e não na repressão policial. A guerra contra as drogas é uma guerra perdida, que só serve para lotar as cadeias, consumir dinheiro e vidas. Em vez de perseguir quem cultiva uma plantinha, a polícia deveria se concentrar em prender ladrões e assassinos, que são os verdadeiros problemas da sociedade.","E olha que aqui tá cheio de liberais no sub, mesmo assim muitos defendem continuar esse sistema que não funciona, vai entender... brasileiro médio é conservador nos costumes",Concorda,CONCORDA,"A mensagem atual reforça a crítica à hipocrisia da direita, apontada na mensagem de referência, ao destacar que o controle estatal é aceito por eles quando baseado em seu próprio moralismo, mesmo que contradiga a defesa da liberdade individual.",drogas
1,4,"Faz uma enquete sobre legalização do aborto para você ver o que acontece, as pessoas ficam malucas com esse tema, mesmo liberais são contra, eu já desisti da ideia, mas tanto faz porque provavelmente o STF vai legalizar o aborto daqui uns anos, via Congresso que não vai ser.","Eu acho que a direita está sendo hipócrita ao defender a redução do Estado e as liberdades individuais, mas ao mesmo tempo querer que o Estado controle o que as pessoas podem ou não consumir. Isso é uma incoerência total!\n\nAcredito que a luta contra as drogas deve ser focada na educação, conscientização e saúde, e não na repressão policial. A guerra contra as drogas é uma guerra perdida, que só serve para lotar as cadeias, consumir dinheiro e vidas. Em vez de perseguir quem cultiva uma plantinha, a polícia deveria se concentrar em prender ladrões e assassinos, que são os verdadeiros problemas da sociedade.","Daí dizem que defender o controle do Estado na vida das pessoas é coisa de esquerdista... Mas se for o controle com base no meu moralismo, daí pode. 😂",Concorda,CONCORDA,"A mensagem atual, ao mencionar a questão do aborto e a reação das pessoas, reforça a ideia de que mesmo liberais podem ser conservadores em certos temas, o que se alinha com a crítica da mensagem de referência sobre a hipocrisia da direita em relação à liberdade individual e o controle estatal. O usuário continua a linha de raciocínio sobre a incoerência entre a defesa da liberdade e o controle moralista.",drogas
1,5,"Pois é... outra vez: aborto não é questão de Estado e muito menos de polícia. Deixem isso pra Medicina, Ciência, Saúde Pública. \n\nCiência: fetos, principalmente no início da gestação, não têm sistema nervoso desenvolvido, não têm consciência nem capacidade de sentir dor. Quem pode sofrer são principalmente as mulheres e as crianças que vêm ao mundo com deficiências, sem uma estrutura econômica, psicológica ou familiar.\n\nMas é inconveniente pra eles deixar isso nas mãos da ciência, preferem deixar que a polícia cuide, porque sabem que a defesa deles só se sustenta com CRENDICES. \n\nDevido a crendices, muitas famílias decidem continuar com gravidez problemática, colocando em risco a vida da mãe e trazendo ao mundo crianças que vão sofrer pelo resto da vida com suas famílias. Essa atitude é mais grave que o próprio aborto. Quem é contra o aborto na verdade está promovendo todo esse sofrimento e posam de \""defensores da vida, da família e dos bons costumes\"". \n\nAs máscaras desses já caíram faz tempo.","Eu acho que a direita está sendo hipócrita ao defender a redução do Estado e as liberdades individuais, mas ao mesmo tempo querer que o Estado controle o que as pessoas podem ou não consumir. Isso é uma incoerência total!\n\nAcredito que a luta contra as drogas deve ser focada na educação, conscientização e saúde, e não na repressão policial. A guerra contra as drogas é uma guerra perdida, que só serve para lotar as cadeias, consumir dinheiro e vidas. Em vez de perseguir quem cultiva uma plantinha, a polícia deveria se concentrar em prender ladrões e assassinos, que são os verdadeiros problemas da sociedade.","Faz uma enquete sobre legalização do aborto para você ver o que acontece, as pessoas ficam malucas com esse tema, mesmo liberais são contra, eu já desisti da ideia, mas tanto faz porque provavelmente o STF vai legalizar o aborto daqui uns anos, via Congresso que não vai ser.",Concorda,CONCORDA,"A mensagem atual concorda com a mensagem de referência ao criticar a hipocrisia de quem defende a redução do Estado, mas quer que ele controle a vida das pessoas com base em ""crendices"", assim como a referência critica a hipocrisia da direita em relação ao controle do consumo. Ambas as mensagens defendem a saída do Estado de questões que deveriam ser tratadas por outras esferas (saúde/ciência para o aborto, educação/saúde para as drogas) e criticam a repressão policial.",drogas
1,6,"Se depender dos conservadores, eles vão proibir até em caso de estupro. Pra eles qualquer célula dentro do útero é uma vida que tem que ser preservada a qualquer custo.","Eu acho que a direita está sendo hipócrita ao defender a redução do Estado e as liberdades individuais, mas ao mesmo tempo querer que o Estado controle o que as pessoas podem ou não consumir. Isso é uma incoerência total!\n\nAcredito que a luta contra as drogas deve ser focada na educação, conscientização e saúde, e não na repressão policial. A guerra contra as drogas é uma guerra perdida, que só serve para lotar as cadeias, consumir dinheiro e vidas. Em vez de perseguir quem cultiva uma plantinha, a polícia deveria se concentrar em prender ladrões e assassinos, que são os verdadeiros problemas da sociedade.","Pois é... outra vez: aborto não é questão de Estado e muito menos de polícia. Deixem isso pra Medicina, Ciência, Saúde Pública. \n\nCiência: fetos, principalmente no início da gestação, não têm sistema nervoso desenvolvido, não têm consciência nem capacidade de sentir dor. Quem pode sofrer são principalmente as mulheres e as crianças que vêm ao mundo com deficiências, sem uma estrutura econômica, psicológica ou familiar.\n\nMas é inconveniente pra eles deixar isso nas mãos da ciência, preferem deixar que a polícia cuide, porque sabem que a defesa deles só se sustenta com CRENDICES. \n\nDevido a crendices, muitas famílias decidem continuar com gravidez problemática, colocando em risco a vida da mãe e trazendo ao mundo crianças que vão sofrer pelo resto da vida com suas famílias. Essa atitude é mais grave que o próprio aborto. Quem é contra o aborto na verdade está promovendo todo esse sofrimento e posam de \""defensores da vida, da família e dos bons costumes\"". \n\nAs máscaras desses já caíram faz tempo.",Concorda,CONCORDA,"A mensagem atual, ao criticar a postura conservadora em relação ao aborto, alinha-se com a crítica da mensagem de referência sobre a hipocrisia da direita em querer controlar a vida das pessoas, apesar de defender a redução do Estado. Ambas as mensagens apontam para uma contradição na ideologia conservadora.",drogas
1,7,"Sim,se tem célula tem vida....o mínimo que você deveria saber!!! O feto é uma vida se não fosse não precisava abortar","Eu acho que a direita está sendo hipócrita ao defender a redução do Estado e as liberdades individuais, mas ao mesmo tempo querer que o Estado controle o que as pessoas podem ou não consumir. Isso é uma incoerência total!\n\nAcredito que a luta contra as drogas deve ser focada na educação, conscientização e saúde, e não na repressão policial. A guerra contra as drogas é uma guerra perdida, que só serve para lotar as cadeias, consumir dinheiro e vidas. Em vez de perseguir quem cultiva uma plantinha, a polícia deveria se concentrar em prender ladrões e assassinos, que são os verdadeiros problemas da sociedade.","Se depender dos conservadores, eles vão proibir até em caso de estupro. Pra eles qualquer célula dentro do útero é uma vida que tem que ser preservada a qualquer custo.",Outros,DISCORDA,"A mensagem atual defende que ""se tem célula tem vida"", o que se alinha com a visão conservadora criticada na conversa e se opõe implicitamente à defesa da liberdade individual e da não intervenção estatal em questões de consumo e costumes, que é o cerne da mensagem de referência.",drogas
1,8,"Imagina ser contra assassinato de inocentes né... Que coisa mais estranha, como pode um liberal ser contra isso?","Eu acho que a direita está sendo hipócrita ao defender a redução do Estado e as liberdades individuais, mas ao mesmo tempo querer que o Estado controle o que as pessoas podem ou não consumir. Isso é uma incoerência total!\n\nAcredito que a luta contra as drogas deve ser focada na educação, conscientização e saúde, e não na repressão policial. A guerra contra as drogas é uma guerra perdida, que só serve para lotar as cadeias, consumir dinheiro e vidas. Em vez de perseguir quem cultiva uma plantinha, a polícia deveria se concentrar em prender ladrões e assassinos, que são os verdadeiros problemas da sociedade.","Faz uma enquete sobre legalização do aborto para você ver o que acontece, as pessoas ficam malucas com esse tema, mesmo liberais são contra, eu já desisti da ideia, mas tanto faz porque provavelmente o STF vai legalizar o aborto daqui uns anos, via Congresso que não vai ser.",Outros,DISCORDA,"A mensagem atual, ao ironizar a oposição ao ""assassinato de inocentes"" no contexto do aborto, contradiz o espírito da mensagem de referência que critica a intervenção estatal em liberdades individuais e defende a descriminalização de certas práticas. A ironia sugere que a defesa da vida do feto é uma posição óbvia e que a crítica à hipocrisia da direita não se aplica a este caso.",drogas
1,9,">Imagina ser contra assassinato de inocentes né... \n\nImagino que, pra manter sua coerência, você seja vegano. \n\nVoltemos à ciência: fetos jamais desenvolveram consciência e não sentem dor. \n\nAnimais, incluindo todas as aves e mamíferos, possuem um sistema nervoso complexo com parte cerebrais similares ao cérebro humano capazes de produzir consciência. Eles sofrem e sentem a mesma dor que você. (Declaração de Cambridge sobre a Consciência dos Animais). \n\nSe você é realmente contra o sofrimento e assassinato de inocentes, por coerência, deve ser vegano.\n\nMas a gente já sabe que esse discurso \""a favor da vida, da família, dos bons costumes...\"" é pura hipocrisia.","Eu acho que a direita está sendo hipócrita ao defender a redução do Estado e as liberdades individuais, mas ao mesmo tempo querer que o Estado controle o que as pessoas podem ou não consumir. Isso é uma incoerência total!\n\nAcredito que a luta contra as drogas deve ser focada na educação, conscientização e saúde, e não na repressão policial. A guerra contra as drogas é uma guerra perdida, que só serve para lotar as cadeias, consumir dinheiro e vidas. Em vez de perseguir quem cultiva uma plantinha, a polícia deveria se concentrar em prender ladrões e assassinos, que são os verdadeiros problemas da sociedade.","Imagina ser contra assassinato de inocentes né... Que coisa mais estranha, como pode um liberal ser contra isso?",Outros,CONCORDA,"A mensagem atual reforça a ideia de hipocrisia da direita, presente na mensagem de referência, ao usar o argumento do veganismo para expor a incoerência de quem se diz ""a favor da vida"" mas não estende essa preocupação a outras formas de vida que sentem dor. O autor da mensagem atual também retoma o argumento científico sobre a ausência de consciência e dor em fetos, que já havia sido introduzido em uma mensagem anterior (5), alinhando-se à crítica à postura conservadora.",drogas
1,10,"Uma bactéria em marte = Vida.\n\nUm feto no útero da mãe = Não é vida.\n\nVai entender a cabeça de vocês liberalecos, moralmente estão a um passinho da Esquerda e nem percebem. Ainda compara a vida de um animal com a de um ser humano, é muita desonestidade intelectual.","Eu acho que a direita está sendo hipócrita ao defender a redução do Estado e as liberdades individuais, mas ao mesmo tempo querer que o Estado controle o que as pessoas podem ou não consumir. Isso é uma incoerência total!\n\nAcredito que a luta contra as drogas deve ser focada na educação, conscientização e saúde, e não na repressão policial. A guerra contra as drogas é uma guerra perdida, que só serve para lotar as cadeias, consumir dinheiro e vidas. Em vez de perseguir quem cultiva uma plantinha, a polícia deveria se concentrar em prender ladrões e assassinos, que são os verdadeiros problemas da sociedade.",">Imagina ser contra assassinato de inocentes né... \n\nImagino que, pra manter sua coerência, você seja vegano. \n\nVoltemos à ciência: fetos jamais desenvolveram consciência e não sentem dor. \n\nAnimais, incluindo todas as aves e mamíferos, possuem um sistema nervoso complexo com parte cerebrais similares ao cérebro humano capazes de produzir consciência. Eles sofrem e sentem a mesma dor que você. (Declaração de Cambridge sobre a Consciência dos Animais). \n\nSe você é realmente contra o sofrimento e assassinato de inocentes, por coerência, deve ser vegano.\n\nMas a gente já sabe que esse discurso \""a favor da vida, da família, dos bons costumes...\"" é pura hipocrisia.",Outros,DISCORDA,"A mensagem atual critica a posição dos ""liberalecos"" (termo pejorativo para liberais) ao comparar a vida de uma bactéria com a de um feto, e a vida de um animal com a de um ser humano, o que se alinha com a defesa da vida fetal e, por extensão, com a visão conservadora que a mensagem de referência critica. Embora a mensagem atual não se refira diretamente à questão das drogas, ela se posiciona contra o que percebe como incoerência dos liberais, que é o tema central da mensagem de referência.",drogas
1,11,">Uma bactéria em marte = Vida.  \n>  \n>Um feto no útero da mãe = Não é vida.\n\nNinguém diz isso. Só na sua cabeça. Bactérias são vida, nem por isso vc deixa de lavar as mãos pra salvar as bactérias. \n\n&#x200B;\n\n>Ainda compara a vida de um animal com a de um ser humano, é muita desonestidade intelectual.\n\nSOMOS ANIMAIS, esqueceu? Mamíferos.\n\nQuem faz essa comparação é UMA CONVENÇÃO DE CIENTISTAS em Cambridge, incluindo Stephen Hawking. É o documento mais importante da história sobre o reconhecimento da Ciência de que animais têm um sistema nervoso tão complexo quanto o de humanos e sentem a mesma dor ou até mais. \n\nSomos também animais, mais semelhantes do que diferentes daqueles que exploramos. Somos primos neste planeta.","Eu acho que a direita está sendo hipócrita ao defender a redução do Estado e as liberdades individuais, mas ao mesmo tempo querer que o Estado controle o que as pessoas podem ou não consumir. Isso é uma incoerência total!\n\nAcredito que a luta contra as drogas deve ser focada na educação, conscientização e saúde, e não na repressão policial. A guerra contra as drogas é uma guerra perdida, que só serve para lotar as cadeias, consumir dinheiro e vidas. Em vez de perseguir quem cultiva uma plantinha, a polícia deveria se concentrar em prender ladrões e assassinos, que são os verdadeiros problemas da sociedade.","Uma bactéria em marte = Vida.\n\nUm feto no útero da mãe = Não é vida.\n\nVai entender a cabeça de vocês liberalecos, moralmente estão a um passinho da Esquerda e nem percebem. Ainda compara a vida de um animal com a de um ser humano, é muita desonestidade intelectual.",Outros,OUTROS,"A mensagem atual não se posiciona diretamente sobre a mensagem de referência, que trata da hipocrisia da direita em relação ao controle estatal e à guerra às drogas. Em vez disso, a mensagem atual continua a discussão sobre a definição de vida e a comparação entre humanos e animais, que se desviou do tema original.",drogas
1,12,"Ô meu amigo, você tá só provando o meu ponto.  \n\n\nO que eu disse foi = as pessoas que defendem aborto consideram uma bacteria em Marte como vida, mas na hora de considerar um feto HUMANO ai não é vida.   \n\n\nPor quê essa diferença? Eu só estou questionando a hipocrisia aqui.  \n\n\nSim, bactérias são vida, mas nunca levarão a nada.  \n\n\nJá um feto não é só vida, mas como também é VIDA HUMANA, que se tornará um ser humano formado. A vida humana é mais preciosa e rara do que qualquer outro animal no planeta terra. Você querer comparar o ser humano a uma vaca, a um macaco, ou qualquer outro caralho por meramente biologia é extremamente estúpido.   \n\n\nSe você entendesse um tiquinho só de ciência, como finge que entende. Você saberia o quanto a vida humana é especial no contexto do universo e quão extremamente implausíveis as circunstâncias do destino tiveram que ser para que surgisse vida inteligente no nosso planeta.","Eu acho que a direita está sendo hipócrita ao defender a redução do Estado e as liberdades individuais, mas ao mesmo tempo querer que o Estado controle o que as pessoas podem ou não consumir. Isso é uma incoerência total!\n\nAcredito que a luta contra as drogas deve ser focada na educação, conscientização e saúde, e não na repressão policial. A guerra contra as drogas é uma guerra perdida, que só serve para lotar as cadeias, consumir dinheiro e vidas. Em vez de perseguir quem cultiva uma plantinha, a polícia deveria se concentrar em prender ladrões e assassinos, que são os verdadeiros problemas da sociedade.",">Uma bactéria em marte = Vida.  \n>  \n>Um feto no útero da mãe = Não é vida.\n\nNinguém diz isso. Só na sua cabeça. Bactérias são vida, nem por isso vc deixa de lavar as mãos pra salvar as bactérias. \n\n&#x200B;\n\n>Ainda compara a vida de um animal com a de um ser humano, é muita desonestidade intelectual.\n\nSOMOS ANIMAIS, esqueceu? Mamíferos.\n\nQuem faz essa comparação é UMA CONVENÇÃO DE CIENTISTAS em Cambridge, incluindo Stephen Hawking. É o documento mais importante da história sobre o reconhecimento da Ciência de que animais têm um sistema nervoso tão complexo quanto o de humanos e sentem a mesma dor ou até mais. \n\nSomos também animais, mais semelhantes do que diferentes daqueles que exploramos. Somos primos neste planeta.",Outros,DISCORDA,"A mensagem atual, embora não se refira diretamente à mensagem de referência, está inserida em uma discussão que se afastou do tema original (drogas) para o aborto. O usuário Chelsea_Jones, na mensagem atual, defende a sacralidade da vida humana desde o feto, o que se opõe implicitamente à ideia de liberdade individual e não-intervenção estatal defendida na mensagem de referência, especialmente se essa liberdade incluir a escolha sobre o aborto.",drogas
1,13,">Ô meu amigo, você tá só provando o meu ponto.  \n>  \n>O que eu disse foi = as pessoas que defendem aborto consideram uma bacteria em Marte como vida, mas na hora de considerar um feto HUMANO ai não é vida.  \n>  \n>Por quê essa diferença? Eu só estou questionando a hipocrisia aqui.\n\nNão, porque ninguém diz que feto humano não é vida. Seu raciocínio está incorreto. Tanto que matamos bactérias.\n\n&#x200B;\n\n>Sim, bactérias são vida, mas nunca levarão a nada.  \n>  \n>Já um feto não é só vida, mas como também é VIDA HUMANA, que se tornará um ser humano formado.\n\nAssim como os bilhões de espermatozoides que você mata no papel higiênico.\n\n&#x200B;\n\n>A vida humana é mais preciosa e rara do que qualquer outro animal no planeta terra. Você querer comparar o ser humano a uma vaca, a um macaco, ou qualquer outro caralho por meramente biologia é extremamente estúpido.\n\nO fato de a vida humana ser preciosa não possui absolutamente nenhuma implicação lógica e racional em massacrar animais. Isso só denuncia sua hipocrisia. Você não é favor da vida e contra o sofrimento, mas só a favor do seu moralismo e crendice religiosa.\n\n&#x200B;\n\n>Se você entendesse um tiquinho só de ciência, como finge que entende. Você saberia o quanto a vida humana é especial no contexto do universo e quão extremamente implausíveis as circunstâncias do destino tiveram que ser para que surgisse vida inteligente no nosso planeta.\n\nMas muitos se esquecem de usar essa inteligência pra parar de explorar animais... e parar de fazer crianças e mulheres sofrerem defendendo crendices religiosas.","Eu acho que a direita está sendo hipócrita ao defender a redução do Estado e as liberdades individuais, mas ao mesmo tempo querer que o Estado controle o que as pessoas podem ou não consumir. Isso é uma incoerência total!\n\nAcredito que a luta contra as drogas deve ser focada na educação, conscientização e saúde, e não na repressão policial. A guerra contra as drogas é uma guerra perdida, que só serve para lotar as cadeias, consumir dinheiro e vidas. Em vez de perseguir quem cultiva uma plantinha, a polícia deveria se concentrar em prender ladrões e assassinos, que são os verdadeiros problemas da sociedade.","Ô meu amigo, você tá só provando o meu ponto.  \n\n\nO que eu disse foi = as pessoas que defendem aborto consideram uma bacteria em Marte como vida, mas na hora de considerar um feto HUMANO ai não é vida.   \n\n\nPor quê essa diferença? Eu só estou questionando a hipocrisia aqui.  \n\n\nSim, bactérias são vida, mas nunca levarão a nada.  \n\n\nJá um feto não é só vida, mas como também é VIDA HUMANA, que se tornará um ser humano formado. A vida humana é mais preciosa e rara do que qualquer outro animal no planeta terra. Você querer comparar o ser humano a uma vaca, a um macaco, ou qualquer outro caralho por meramente biologia é extremamente estúpido.   \n\n\nSe você entendesse um tiquinho só de ciência, como finge que entende. Você saberia o quanto a vida humana é especial no contexto do universo e quão extremamente implausíveis as circunstâncias do destino tiveram que ser para que surgisse vida inteligente no nosso planeta.",Outros,CONCORDA,"A mensagem atual, ao criticar a hipocrisia e o moralismo religioso em relação à vida e ao sofrimento, alinha-se com a crítica inicial da mensagem de referência sobre a incoerência da direita em defender liberdades individuais e, ao mesmo tempo, querer controlar o consumo. Ambas as mensagens apontam para a hipocrisia de discursos que se dizem ""a favor da vida"" mas promovem sofrimento.",drogas
