target_id,mensagem_id,message,target_message,parent_message,label_original,classificacao,justificativa,assunto
34,3,"\""Um monte de playboyzinho\"", irmão você já foi torturado pela PM? Eu já fui.","Eu acho que se a maconha fosse mecanismo de controle social, já estaria descriminalizado e legalizado há muito. Porém, vejo com bons olhos a liberação para uso medicinal, dado que achava que a sociedade brasileira era mais conservadora","Não foi discriminalizado porque a elite não aceitava. Álcool sempre fez parte da cultura dos ricos, maconha era coisa pobre marginal.\n\nAgora que um monte de playboyzinho que ter ter o direito de passar o dia coçando o saco e fumando sem ter estigma nenhum, aí sim eles cogitam liberar.",Outros,OUTROS,"A mensagem atual não se posiciona diretamente sobre a mensagem de referência. Ela reage a um termo usado na mensagem anterior ([2] Stephanie_Harris) e introduz uma experiência pessoal, sem expressar concordância ou discordância com a legalização da maconha ou seu uso medicinal.",drogas
34,4,"Eu já fui também meu jovem, mas a sua opinião, a minha, nem a de todos o proletários que tiveram que comer paranga ou tiveram as costas moídas com dichavador, não conta pra quem decide se vai descriminalizar ou não, porque quem decide é a elite.","Eu acho que se a maconha fosse mecanismo de controle social, já estaria descriminalizado e legalizado há muito. Porém, vejo com bons olhos a liberação para uso medicinal, dado que achava que a sociedade brasileira era mais conservadora","\""Um monte de playboyzinho\"", irmão você já foi torturado pela PM? Eu já fui.",Discorda,DISCORDA,"A mensagem atual, assim como a mensagem [2] da mesma autora, discorda da mensagem de referência ao reiterar que a descriminalização da maconha não ocorreu devido à elite, e não por ser um mecanismo de controle social. Ela reforça a ideia de que a decisão está nas mãos da elite, ignorando a opinião da população.",drogas
34,5,"\""tirar da população a atenção do que realmente importa\""\n\""Te querem fumando maconha para você ficar Manso\""\n\""Fumar maconha e coçar o saco\""\nAh amigo, você não quer bater na minha cara também não?","Eu acho que se a maconha fosse mecanismo de controle social, já estaria descriminalizado e legalizado há muito. Porém, vejo com bons olhos a liberação para uso medicinal, dado que achava que a sociedade brasileira era mais conservadora","Eu já fui também meu jovem, mas a sua opinião, a minha, nem a de todos o proletários que tiveram que comer paranga ou tiveram as costas moídas com dichavador, não conta pra quem decide se vai descriminalizar ou não, porque quem decide é a elite.",Outros,OUTROS,"A mensagem atual não se posiciona diretamente sobre a mensagem de referência. Ela reage a frases ditas por outro participante da conversa, expressando um sentimento de ofensa ou indignação, sem abordar a questão da descriminalização ou uso medicinal da maconha.",drogas
34,6,Você gosta?,"Eu acho que se a maconha fosse mecanismo de controle social, já estaria descriminalizado e legalizado há muito. Porém, vejo com bons olhos a liberação para uso medicinal, dado que achava que a sociedade brasileira era mais conservadora","\""tirar da população a atenção do que realmente importa\""\n\""Te querem fumando maconha para você ficar Manso\""\n\""Fumar maconha e coçar o saco\""\nAh amigo, você não quer bater na minha cara também não?",Outros,OUTROS,"A mensagem atual é uma pergunta direta que não se posiciona sobre o conteúdo da mensagem de referência. Ela busca uma resposta ou esclarecimento do interlocutor, sem expressar concordância ou discordância com a legalização da maconha ou seu uso medicinal.",drogas
34,7,"Isso não faz sentido. Eu acho que você está bastante desinformado a respeito da história de como ocorreu a criminalização da maconha, além de ter uma inclinação autoritária.","Eu acho que se a maconha fosse mecanismo de controle social, já estaria descriminalizado e legalizado há muito. Porém, vejo com bons olhos a liberação para uso medicinal, dado que achava que a sociedade brasileira era mais conservadora","Não foi discriminalizado porque a elite não aceitava. Álcool sempre fez parte da cultura dos ricos, maconha era coisa pobre marginal.\n\nAgora que um monte de playboyzinho que ter ter o direito de passar o dia coçando o saco e fumando sem ter estigma nenhum, aí sim eles cogitam liberar.",Concorda,OUTROS,"A mensagem atual não se posiciona diretamente sobre a mensagem de referência. Em vez disso, ela critica a mensagem [2] de Stephanie_Harris, que por sua vez, discordou da mensagem de referência.",drogas
34,8,Os motivos pelo qual foi criminalizada são bem diferentes dos motivos pelo qual querem descriminalizar.\n\nTodos os países mais a esquerda que são superpotências são considerados de inclinação autoritária.,"Eu acho que se a maconha fosse mecanismo de controle social, já estaria descriminalizado e legalizado há muito. Porém, vejo com bons olhos a liberação para uso medicinal, dado que achava que a sociedade brasileira era mais conservadora","Isso não faz sentido. Eu acho que você está bastante desinformado a respeito da história de como ocorreu a criminalização da maconha, além de ter uma inclinação autoritária.",Outros,DISCORDA,"A mensagem atual, ao afirmar que os motivos para a criminalização são diferentes dos motivos para a descriminalização, contradiz a ideia implícita na mensagem de referência de que a não descriminalização se deve à falta de um mecanismo de controle social. Além disso, a mensagem atual defende a ideia de que a descriminalização é um desejo da elite, o que se alinha com a argumentação anterior da Stephanie_Harris, que discordava da mensagem de referência.",drogas
35,2,"Não mano … é plantinha.    \n   \n\nÉ semente na terra e água, simples assim. \n\n   \nCompra na feira, ou tem num vaso em casa, ou planta pra rua.    \n   \nIgual uma salsinha, um mamão.","Eu acho que a liberação da maconha para uso medicinal e industrial é um passo importante, pois permite que a indústria brasileira aproveite as vantagens econômicas e de emprego que essa cultura pode gerar, além de fornecer produtos de qualidade para o mercado. Além disso, isso pode ajudar a desvincular a maconha de seu uso recreativo e mostrar que ela tem outras aplicações legítimas e benéficas.",Eu sou a favor da maconha industrial\n\nLiberar para o agronegócio plantar\n\nA Industria produzir\n\nE o comércio vender,Discorda,CONCORDA,"A mensagem atual concorda com a ideia de desmistificar a maconha, reforçando a naturalidade da planta ao compará-la com outras culturas comuns, o que se alinha com a proposta de desvincular seu uso recreativo e mostrar outras aplicações legítimas.",drogas
35,3,"Eu quero sair do trabalho\n\nPassar no Carrefour, comprar pão, carne e ganja e pagar com o cartão alimentação da firma \n\nNão planto nem cactos e não gosto de feiras","Eu acho que a liberação da maconha para uso medicinal e industrial é um passo importante, pois permite que a indústria brasileira aproveite as vantagens econômicas e de emprego que essa cultura pode gerar, além de fornecer produtos de qualidade para o mercado. Além disso, isso pode ajudar a desvincular a maconha de seu uso recreativo e mostrar que ela tem outras aplicações legítimas e benéficas.","Não mano … é plantinha.    \n   \n\nÉ semente na terra e água, simples assim. \n\n   \nCompra na feira, ou tem num vaso em casa, ou planta pra rua.    \n   \nIgual uma salsinha, um mamão.",Concorda,CONCORDA,"A mensagem atual, ao expressar o desejo de comprar ""ganja"" (maconha) legalmente e de forma conveniente, alinha-se com a ideia da mensagem de referência sobre a liberação e comercialização da maconha, inclusive para uso recreativo, que é uma extensão da desvinculação do uso recreativo. A mensagem atual também se opõe implicitamente à ideia da mensagem [2] de que a maconha é apenas uma ""plantinha"" para ser cultivada em casa ou comprada em feiras, reforçando a necessidade de um mercado formal.",drogas
35,4,"Aqui no Canadá é basicamente assim e a sociedade não ruiu, não entrou em colapso.","Eu acho que a liberação da maconha para uso medicinal e industrial é um passo importante, pois permite que a indústria brasileira aproveite as vantagens econômicas e de emprego que essa cultura pode gerar, além de fornecer produtos de qualidade para o mercado. Além disso, isso pode ajudar a desvincular a maconha de seu uso recreativo e mostrar que ela tem outras aplicações legítimas e benéficas.","Eu quero sair do trabalho\n\nPassar no Carrefour, comprar pão, carne e ganja e pagar com o cartão alimentação da firma \n\nNão planto nem cactos e não gosto de feiras",Concorda,CONCORDA,"A mensagem atual, ao citar o exemplo do Canadá onde a sociedade não ruiu com a liberação da maconha, reforça a ideia da mensagem de referência de que a liberação da maconha (mesmo que para uso recreativo, como implícito na resposta anterior) não traz consequências negativas e, portanto, apoia a visão de que a maconha tem aplicações legítimas e benéficas.",drogas
35,5,Não é possível. Mentiram para nós o tempo todo?\n\nQue se liberassem a maconha todo mundo se jogaria chapado pelas ruas?,"Eu acho que a liberação da maconha para uso medicinal e industrial é um passo importante, pois permite que a indústria brasileira aproveite as vantagens econômicas e de emprego que essa cultura pode gerar, além de fornecer produtos de qualidade para o mercado. Além disso, isso pode ajudar a desvincular a maconha de seu uso recreativo e mostrar que ela tem outras aplicações legítimas e benéficas.","Aqui no Canadá é basicamente assim e a sociedade não ruiu, não entrou em colapso.",Concorda,CONCORDA,"A mensagem atual, ao questionar ironicamente a ideia de que a liberação da maconha levaria ao caos, reforça a visão da mensagem de referência de que a maconha tem aplicações legítimas e que a liberação não é prejudicial. Ela alinha-se com a ideia de desmistificar o uso da maconha.",drogas
35,6,"maconha industrial para o agronegócio (celulose, fibra, ração etc)\n\nmaconha medicinal e recreativa para a agricultura familiar","Eu acho que a liberação da maconha para uso medicinal e industrial é um passo importante, pois permite que a indústria brasileira aproveite as vantagens econômicas e de emprego que essa cultura pode gerar, além de fornecer produtos de qualidade para o mercado. Além disso, isso pode ajudar a desvincular a maconha de seu uso recreativo e mostrar que ela tem outras aplicações legítimas e benéficas.",Eu sou a favor da maconha industrial\n\nLiberar para o agronegócio plantar\n\nA Industria produzir\n\nE o comércio vender,Discorda,CONCORDA,"A mensagem atual reforça a ideia da mensagem de referência sobre a liberação da maconha para uso medicinal e industrial, detalhando as aplicações e sugerindo a divisão entre agronegócio e agricultura familiar, o que se alinha com a visão de aproveitamento econômico e de emprego.",drogas
35,7,"Por que a Souza Cruz ou a Phillip Morris não podem produzir uma carteira?\n\nTipo, quem mora em apartamento, não tem tempo de plantar, colher, secar, prensar e enrolar\n\nFaz como?\n\nComo eu disse no outro post, o cara tem que poder sair do trabalho, passar no mercado e comprar pão, carne e ganja.","Eu acho que a liberação da maconha para uso medicinal e industrial é um passo importante, pois permite que a indústria brasileira aproveite as vantagens econômicas e de emprego que essa cultura pode gerar, além de fornecer produtos de qualidade para o mercado. Além disso, isso pode ajudar a desvincular a maconha de seu uso recreativo e mostrar que ela tem outras aplicações legítimas e benéficas.","maconha industrial para o agronegócio (celulose, fibra, ração etc)\n\nmaconha medicinal e recreativa para a agricultura familiar",Concorda,CONCORDA,"A mensagem atual, ao defender a produção e venda de maconha por grandes empresas para facilitar o acesso, reforça a ideia da mensagem de referência sobre a liberação da maconha para fins comerciais e a desvinculação do uso recreativo de atividades ilegais. Ela apoia a visão de que a maconha pode ser um produto de mercado, acessível e regulamentado.",drogas
35,8,"Eu só não sou a favor disso por motivos parecidos do que sou contra o álcool, mas seria bem mais seguro do que alguém plantar.","Eu acho que a liberação da maconha para uso medicinal e industrial é um passo importante, pois permite que a indústria brasileira aproveite as vantagens econômicas e de emprego que essa cultura pode gerar, além de fornecer produtos de qualidade para o mercado. Além disso, isso pode ajudar a desvincular a maconha de seu uso recreativo e mostrar que ela tem outras aplicações legítimas e benéficas.",Eu sou a favor da maconha industrial\n\nLiberar para o agronegócio plantar\n\nA Industria produzir\n\nE o comércio vender,Discorda,DISCORDA,"A mensagem atual expressa uma posição contrária à liberação da maconha, comparando-a ao álcool, o que vai de encontro à proposta da mensagem de referência de liberar a maconha para fins medicinais e industriais. Embora mencione que seria mais seguro do que alguém plantar, o motivo principal é a desaprovação.",drogas
35,9,pq alguém plantar seua própria ganja é perigoso?,"Eu acho que a liberação da maconha para uso medicinal e industrial é um passo importante, pois permite que a indústria brasileira aproveite as vantagens econômicas e de emprego que essa cultura pode gerar, além de fornecer produtos de qualidade para o mercado. Além disso, isso pode ajudar a desvincular a maconha de seu uso recreativo e mostrar que ela tem outras aplicações legítimas e benéficas.","Eu só não sou a favor disso por motivos parecidos do que sou contra o álcool, mas seria bem mais seguro do que alguém plantar.",Outros,OUTROS,"A mensagem atual não se posiciona diretamente sobre a mensagem de referência, mas sim questiona um ponto levantado na mensagem [8] que, por sua vez, discorda da mensagem de referência. A pergunta busca esclarecimento e não expressa concordância ou discordância com a liberação da maconha.",drogas
35,10,Porque não vai ter controle do quanto de cbd/thc tem nas buds que vão ser fumadas. Atualmente só com equipamento de laboratório dá pra fazer isso,"Eu acho que a liberação da maconha para uso medicinal e industrial é um passo importante, pois permite que a indústria brasileira aproveite as vantagens econômicas e de emprego que essa cultura pode gerar, além de fornecer produtos de qualidade para o mercado. Além disso, isso pode ajudar a desvincular a maconha de seu uso recreativo e mostrar que ela tem outras aplicações legítimas e benéficas.",pq alguém plantar seua própria ganja é perigoso?,Outros,DISCORDA,"A mensagem atual, ao focar na falta de controle sobre o teor de CBD/THC em plantas cultivadas individualmente, levanta uma preocupação que se alinha com a ideia de que a liberação da maconha para uso recreativo, sem controle industrial, pode ser problemática. Isso contraria a visão da mensagem de referência, que defende a liberação para uso medicinal e industrial, implicando um controle de qualidade e padronização.",drogas
35,11,e pq um maconheiro precisa desse controle? tem como ter overdose de ganja se tiver mt concentrado?,"Eu acho que a liberação da maconha para uso medicinal e industrial é um passo importante, pois permite que a indústria brasileira aproveite as vantagens econômicas e de emprego que essa cultura pode gerar, além de fornecer produtos de qualidade para o mercado. Além disso, isso pode ajudar a desvincular a maconha de seu uso recreativo e mostrar que ela tem outras aplicações legítimas e benéficas.",Porque não vai ter controle do quanto de cbd/thc tem nas buds que vão ser fumadas. Atualmente só com equipamento de laboratório dá pra fazer isso,Outros,OUTROS,"A mensagem atual não se posiciona diretamente sobre a mensagem de referência. Ela faz perguntas sobre a necessidade de controle de CBD/THC e o risco de overdose, buscando esclarecimentos sobre um ponto levantado em uma mensagem anterior.",drogas
35,12,"Overdose não, mas depende muito de pessoa pra pessoa, o usuário pode ter algum surto de algum problema psicológico que ele nem sabia que tinha, como depressão ou ansiedade.","Eu acho que a liberação da maconha para uso medicinal e industrial é um passo importante, pois permite que a indústria brasileira aproveite as vantagens econômicas e de emprego que essa cultura pode gerar, além de fornecer produtos de qualidade para o mercado. Além disso, isso pode ajudar a desvincular a maconha de seu uso recreativo e mostrar que ela tem outras aplicações legítimas e benéficas.",e pq um maconheiro precisa desse controle? tem como ter overdose de ganja se tiver mt concentrado?,Outros,DISCORDA,"A mensagem atual, ao focar nos riscos psicológicos do uso da maconha, mesmo sem overdose, alinha-se com a postura de cautela e oposição à liberação expressa anteriormente pela mesma usuária, que discorda da mensagem de referência. Ela reforça a ideia de que a maconha, mesmo que não cause overdose, pode ter efeitos negativos que justificam a não liberação.",drogas
35,13,"A AMBEV emprega uns 20k de pessoas, mais uns outros tantos que devem ter algum tipo de ocupação vinculada ao álcool até o balcão\n\nAlém disso, tem o turismo e as bebidas tradicionais, como a cachaça e o vinho\n\nAs drogas fazem parte da humanidade desde antes das cavernas\n\nÉ injusto que umas sejam legais e outras não","Eu acho que a liberação da maconha para uso medicinal e industrial é um passo importante, pois permite que a indústria brasileira aproveite as vantagens econômicas e de emprego que essa cultura pode gerar, além de fornecer produtos de qualidade para o mercado. Além disso, isso pode ajudar a desvincular a maconha de seu uso recreativo e mostrar que ela tem outras aplicações legítimas e benéficas.","Eu só não sou a favor disso por motivos parecidos do que sou contra o álcool, mas seria bem mais seguro do que alguém plantar.",Concorda,CONCORDA,"A mensagem atual, ao comparar a maconha com o álcool e defender a legalização de ""drogas"" com base em argumentos econômicos e históricos, alinha-se com a ideia da mensagem de referência de que a liberação da maconha pode gerar vantagens econômicas e é uma aplicação legítima.",drogas
35,14,"Concordo, todas deveriam ser ilegais. Você poderia citar também os gastos do SUS com tratamentos de problemas de saúde ligados ao álcool, nortes de pessoas no trânsito, e a própria exploração na produção.\n\nAcha que isso vai ser muito diferente com a maconha? \nPor um lado não vai causar os danos físicos causados pelo álcool, a dependência também menor, mas não dá pra liberar um problema porque outro é liberado.\n\nPensa quanta comida daria pra produzir no mesmo terreno que se produz 1kg de maconha?","Eu acho que a liberação da maconha para uso medicinal e industrial é um passo importante, pois permite que a indústria brasileira aproveite as vantagens econômicas e de emprego que essa cultura pode gerar, além de fornecer produtos de qualidade para o mercado. Além disso, isso pode ajudar a desvincular a maconha de seu uso recreativo e mostrar que ela tem outras aplicações legítimas e benéficas.","A AMBEV emprega uns 20k de pessoas, mais uns outros tantos que devem ter algum tipo de ocupação vinculada ao álcool até o balcão\n\nAlém disso, tem o turismo e as bebidas tradicionais, como a cachaça e o vinho\n\nAs drogas fazem parte da humanidade desde antes das cavernas\n\nÉ injusto que umas sejam legais e outras não",Discorda,DISCORDA,"A mensagem atual discorda da mensagem de referência ao argumentar que a maconha não deveria ser liberada, mesmo que o álcool seja, e ao sugerir que a produção de maconha ocuparia terras que poderiam ser usadas para produzir alimentos, o que vai contra a ideia de benefícios econômicos e sociais da liberação.",drogas
35,15,">mas não dá pra liberar um problema porque outro é liberado\n\nAí tu tá sendo seletivo, a droga de uns pode, a de outros não. Com base em que é feita essa seleção? Quem tem o privilégio de se chapar e quem não tem? Ou todos podem, ou ninguém pode, não tem outro jeito de ser justo e democrático\n\n>Pensa quanta comida daria pra produzir no mesmo terreno que se produz 1kg de maconha?\n\nTu sabe que TODAS as bebidas são produzidas a partir de plantas, né (as únicas exceções que me vêm à cabeça são o hidromel e uma bebida fermentada de leite que eu não lembro o nome)? Seja fruta, cereal, tubérculo...","Eu acho que a liberação da maconha para uso medicinal e industrial é um passo importante, pois permite que a indústria brasileira aproveite as vantagens econômicas e de emprego que essa cultura pode gerar, além de fornecer produtos de qualidade para o mercado. Além disso, isso pode ajudar a desvincular a maconha de seu uso recreativo e mostrar que ela tem outras aplicações legítimas e benéficas.","Concordo, todas deveriam ser ilegais. Você poderia citar também os gastos do SUS com tratamentos de problemas de saúde ligados ao álcool, nortes de pessoas no trânsito, e a própria exploração na produção.\n\nAcha que isso vai ser muito diferente com a maconha? \nPor um lado não vai causar os danos físicos causados pelo álcool, a dependência também menor, mas não dá pra liberar um problema porque outro é liberado.\n\nPensa quanta comida daria pra produzir no mesmo terreno que se produz 1kg de maconha?",Concorda,CONCORDA,"A mensagem atual, ao defender a liberação da maconha e questionar a seletividade na legalização de substâncias, alinha-se com o argumento da mensagem de referência sobre a legitimidade e os benefícios da maconha. Ela reforça a ideia de que a maconha não deve ser tratada de forma diferente de outras substâncias já legalizadas.",drogas
35,16,"Mas eu não acho que o álcool e outras drogas deveriam ser liberados também, ainda mais da forma que é, é um absurdo um menor de idade ter acesso a um bar ou seção de bebidas do mercado no Brasil.\n\nFaria mais sentido estarmos discutindo a limitação do álcool e não a liberação da maconha recreativa.","Eu acho que a liberação da maconha para uso medicinal e industrial é um passo importante, pois permite que a indústria brasileira aproveite as vantagens econômicas e de emprego que essa cultura pode gerar, além de fornecer produtos de qualidade para o mercado. Além disso, isso pode ajudar a desvincular a maconha de seu uso recreativo e mostrar que ela tem outras aplicações legítimas e benéficas.",">mas não dá pra liberar um problema porque outro é liberado\n\nAí tu tá sendo seletivo, a droga de uns pode, a de outros não. Com base em que é feita essa seleção? Quem tem o privilégio de se chapar e quem não tem? Ou todos podem, ou ninguém pode, não tem outro jeito de ser justo e democrático\n\n>Pensa quanta comida daria pra produzir no mesmo terreno que se produz 1kg de maconha?\n\nTu sabe que TODAS as bebidas são produzidas a partir de plantas, né (as únicas exceções que me vêm à cabeça são o hidromel e uma bebida fermentada de leite que eu não lembro o nome)? Seja fruta, cereal, tubérculo...",Discorda,DISCORDA,"A mensagem atual discorda da mensagem de referência ao argumentar que a discussão deveria ser sobre a limitação do álcool, e não a liberação da maconha recreativa, o que vai contra a proposta de liberação da maconha da mensagem original.",drogas
35,17,>Eu só não sou a favor disso por motivos parecidos do que sou contra o álcool\n\nVocê deve ser a diversão de toda festa,"Eu acho que a liberação da maconha para uso medicinal e industrial é um passo importante, pois permite que a indústria brasileira aproveite as vantagens econômicas e de emprego que essa cultura pode gerar, além de fornecer produtos de qualidade para o mercado. Além disso, isso pode ajudar a desvincular a maconha de seu uso recreativo e mostrar que ela tem outras aplicações legítimas e benéficas.","Eu só não sou a favor disso por motivos parecidos do que sou contra o álcool, mas seria bem mais seguro do que alguém plantar.",Outros,OUTROS,"A mensagem atual é uma crítica irônica à postura da usuária Stephanie_Harris, que se opõe à liberação da maconha e do álcool. Ela não se posiciona diretamente sobre a mensagem de referência, mas sim sobre a opinião de outro participante da conversa.",drogas
35,18,"O melhor é proibir o álcool e deixar por conta do PCC/CV, e pedir para a AmBev e Souza Cruz devolver todo o dinheiro ganho ao crime organizado.","Eu acho que a liberação da maconha para uso medicinal e industrial é um passo importante, pois permite que a indústria brasileira aproveite as vantagens econômicas e de emprego que essa cultura pode gerar, além de fornecer produtos de qualidade para o mercado. Além disso, isso pode ajudar a desvincular a maconha de seu uso recreativo e mostrar que ela tem outras aplicações legítimas e benéficas.",>Eu só não sou a favor disso por motivos parecidos do que sou contra o álcool\n\nVocê deve ser a diversão de toda festa,Concorda,CONCORDA,"A mensagem atual, ao ironizar a proibição do álcool e sugerir que isso beneficiaria o crime organizado, implicitamente defende a legalização e regulamentação de substâncias, alinhando-se com a ideia da mensagem de referência de que a liberação da maconha traria benefícios econômicos e desvincularia a substância de seu uso ilícito.",drogas
