target_id,mensagem_id,message,target_message,parent_message,label_original,classificacao,justificativa,assunto
3,6,"> Também já tive e já fui um. Arrumava briga, já bati carro e, em algumas vezes, não morri por detalhe.\n\nQuem tem problemas mentais não deve usar nenhum tipo de droga, acontece isso ai mesmo.\n\nEspero q hj em dia vc ja tenha ido atrás de tratamento psiquiatrico e saber pq vc é assim.","Eu sou a favor da descriminalização da maconha, mas sou contra outras drogas como a cocaína e o crack, que considero mais perigosa para a sociedade.","Também já tive e já fui um. Arrumava briga, já bati carro e, em algumas vezes, não morri por detalhe.\n\nSim, eu usava bastante, e conheci muita gente que também se estragava e fazia merda depois. É tão nocivo quanto álcool, se usada na mesma intensidade. Então é justamente por saber dos riscos e consequências que não vejo como uma boa ideia.\n\nAlém disso, seria uma medida que só fortalecerá o tráfico. Imagina o tanto de pessoas que alegariam ser para consumo próprio, inclusive os quebradas da biqueiras, só pra não irem preso. E como não tem legalização, comprariam direto de traficantes.",Concorda,OUTROS,"A mensagem atual não se posiciona diretamente sobre a descriminalização da maconha ou a periculosidade de outras drogas, que são os temas da mensagem de referência. Em vez disso, ela foca em um comentário pessoal de outro usuário sobre o uso de maconha e sugere problemas mentais e tratamento.",drogas
3,7,"Sim, eu fico pensando na quantidade de pessoas que querem usar crack e não usam porque é \""proibido\"". Certamente é um número bem próximo de 0.","Eu sou a favor da descriminalização da maconha, mas sou contra outras drogas como a cocaína e o crack, que considero mais perigosa para a sociedade.","Sou a favor da descriminalização da maconha, mas não da cocaína e certamente não do crack.",Discorda,DISCORDA,"A mensagem atual discorda da mensagem de referência ao ironizar a ideia de que a proibição do crack e da cocaína impede o uso, sugerindo que a proibição não é um fator relevante para o consumo dessas drogas, ao contrário do que a mensagem de referência implicitamente defende ao considerá-las ""perigosas para a sociedade"" e, portanto, merecedoras de proibição.",drogas
3,8,Vc quer o que então? Regularizar o consumo de um zumbificante sem tratamento?,"Eu sou a favor da descriminalização da maconha, mas sou contra outras drogas como a cocaína e o crack, que considero mais perigosa para a sociedade.","Sim, eu fico pensando na quantidade de pessoas que querem usar crack e não usam porque é \""proibido\"". Certamente é um número bem próximo de 0.",Outros,CONCORDA,"A mensagem atual, ao questionar a regularização do crack, alinha-se com a mensagem de referência que se posiciona contra a descriminalização de drogas como o crack, consideradas mais perigosas. Ambas as mensagens expressam preocupação com os efeitos negativos do crack.",drogas
3,9,Eu queria que pessoas que pensam como você entendessem que adultos vão tomar as decisões deles independente do que vocês pensam.,"Eu sou a favor da descriminalização da maconha, mas sou contra outras drogas como a cocaína e o crack, que considero mais perigosa para a sociedade.",Vc quer o que então? Regularizar o consumo de um zumbificante sem tratamento?,Discorda,OUTROS,"A mensagem atual não se posiciona diretamente sobre a descriminalização da maconha ou outras drogas, nem sobre a periculosidade delas. Ela critica a postura de quem tenta controlar as decisões de adultos, o que é uma resposta à mensagem anterior, mas não à mensagem de referência.",drogas
3,10,"Se a população tem que pagar SUS e Benefício de Prestação Continuada para os crackudos, e ainda tem que ficar lidando com uma cidade suja e perigosa devido a eles, então sim, a sociedade tem sim que ter direito de regular o que eles consomem.","Eu sou a favor da descriminalização da maconha, mas sou contra outras drogas como a cocaína e o crack, que considero mais perigosa para a sociedade.",Eu queria que pessoas que pensam como você entendessem que adultos vão tomar as decisões deles independente do que vocês pensam.,Concorda,CONCORDA,"A mensagem atual reforça a ideia da mensagem de referência de que o crack é perigoso para a sociedade, justificando a necessidade de regulação do consumo devido aos custos sociais e de saúde pública.",drogas
3,11,"A questão da população ser forçada a alguma coisa é apenas errado diretamente e um erro não justifica o outro.\n\nA questão da cidade suja e perigosa, além de ser algo não está sendo evitado hoje, é completamente resolvível você punindo a atividade danosa (sujeira e violência) ao invés da atividade que não é danosa por si.","Eu sou a favor da descriminalização da maconha, mas sou contra outras drogas como a cocaína e o crack, que considero mais perigosa para a sociedade.","Se a população tem que pagar SUS e Benefício de Prestação Continuada para os crackudos, e ainda tem que ficar lidando com uma cidade suja e perigosa devido a eles, então sim, a sociedade tem sim que ter direito de regular o que eles consomem.",Discorda,OUTROS,"A mensagem atual não se posiciona diretamente sobre a descriminalização da maconha ou a periculosidade de outras drogas, que são os pontos centrais da mensagem de referência. Em vez disso, ela foca em refutar o argumento de que a sociedade tem o direito de regular o consumo de drogas devido aos custos sociais e à sujeira/perigo, sem expressar um posicionamento claro sobre a descriminalização em si.",drogas
3,12,"Eu já vi de tudo, agora pra defender legalização de CRACK tem que ser muito degenerado e ter uma ameba no lugar do cérebro. É brincadeira algumas coisas que somos forçados a ler nesse subreddit.","Eu sou a favor da descriminalização da maconha, mas sou contra outras drogas como a cocaína e o crack, que considero mais perigosa para a sociedade.","A questão da população ser forçada a alguma coisa é apenas errado diretamente e um erro não justifica o outro.\n\nA questão da cidade suja e perigosa, além de ser algo não está sendo evitado hoje, é completamente resolvível você punindo a atividade danosa (sujeira e violência) ao invés da atividade que não é danosa por si.",Concorda,CONCORDA,"A mensagem atual concorda com a mensagem de referência ao expressar forte oposição à legalização do crack, reforçando a ideia de que essa droga é perigosa para a sociedade. O tom agressivo e a crítica à defesa da legalização do crack alinham-se com a postura da mensagem de referência.",drogas
3,13,"Eu já vi de tudo, agora pra defender legalização de CRACK tem que ser muito degenerado e ter uma ameba no lugar do cérebro. É brincadeira algumas coisas que somos forçados a ler nesse subreddit.","Eu sou a favor da descriminalização da maconha, mas sou contra outras drogas como a cocaína e o crack, que considero mais perigosa para a sociedade.","Eu já vi de tudo, agora pra defender legalização de CRACK tem que ser muito degenerado e ter uma ameba no lugar do cérebro. É brincadeira algumas coisas que somos forçados a ler nesse subreddit.",Outros,DISCORDA,"A mensagem atual, ao citar e ironizar a fala de outro usuário que critica a defesa da legalização do crack, posiciona-se contra a ideia de que o crack é uma droga que deve ser proibida por ser ""perigosa para a sociedade"", como afirma a mensagem de referência. O usuário Chad_Freeman tem defendido a liberdade individual de escolha em relação ao uso de drogas, o que se opõe à visão da mensagem de referência sobre a proibição do crack.",drogas
3,14,Ron Paul é um corno,"Eu sou a favor da descriminalização da maconha, mas sou contra outras drogas como a cocaína e o crack, que considero mais perigosa para a sociedade.",[https://www.youtube.com/watch?v=T9n4nwxgaQg](https://www.youtube.com/watch?v=T9n4nwxgaQg),Outros,OUTROS,"A mensagem atual é um ataque pessoal e não se relaciona com o tema da descriminalização de drogas, nem com a posição da mensagem de referência. É uma interjeição sem conteúdo argumentativo.",drogas
3,15,"Então deveriam proibir o álcool e principalmente o cigarro. O cigarro sozinho implica em custos centenas de vezes maior do que maconha, crack, cocaína e heroína juntos.","Eu sou a favor da descriminalização da maconha, mas sou contra outras drogas como a cocaína e o crack, que considero mais perigosa para a sociedade.","Se a população tem que pagar SUS e Benefício de Prestação Continuada para os crackudos, e ainda tem que ficar lidando com uma cidade suja e perigosa devido a eles, então sim, a sociedade tem sim que ter direito de regular o que eles consomem.",Discorda,DISCORDA,"A mensagem atual discorda da mensagem de referência ao sugerir que, se o argumento para proibir drogas como crack e cocaína é o custo social, então álcool e cigarro deveriam ser proibidos, pois geram custos ainda maiores. Isso questiona a lógica da distinção feita na mensagem de referência.",drogas
4,2,Não foi no Uruguai que descriminalizaram a maconha?,Eu sou contra a descriminização das drogas no Brasil,"No Bostil, não.",Outros,OUTROS,"A mensagem atual não expressa um posicionamento claro sobre a descriminalização das drogas no Brasil, apenas faz uma pergunta sobre um caso específico (Uruguai), o que não se alinha nem se opõe diretamente à mensagem de referência.",drogas
4,3,"Sim. Até na Suécia fizeram isso. Mas como é país sério e avançado, já voltaram atrás porque viram o começo de merda que estava dando.",Eu sou contra a descriminização das drogas no Brasil,Não foi no Uruguai que descriminalizaram a maconha?,Concorda,CONCORDA,"A mensagem atual, ao citar o exemplo da Suécia que teria voltado atrás na descriminalização devido a ""começo de merda"", reforça a ideia de que a descriminalização das drogas é prejudicial, alinhando-se com a posição da mensagem de referência que é contra a descriminalização.",drogas
4,4,"Maconha é muito menos nociva que cigarro, e também causa muito menos dependência do que a própria nicotina! Não entendo qual problema que a maconha estaria causando lá. Gente com larica fazendo longas filas nos fast food???",Eu sou contra a descriminização das drogas no Brasil,"Sim. Até na Suécia fizeram isso. Mas como é país sério e avançado, já voltaram atrás porque viram o começo de merda que estava dando.",Discorda,DISCORDA,"A mensagem atual defende a maconha como menos nociva que o cigarro e a nicotina, questionando os problemas que a descriminalização poderia causar. Isso se opõe diretamente à posição da mensagem de referência, que é contra a descriminalização das drogas.",drogas
4,5,"Cigarro causa câncer e infarto, mas não é psicoativo e nem alucinógeno. Maconha acaba com seu cérebro e pode causar diversos problemas degenerativos no sistema nervoso. Ou seja, ambos são muito nocivos de maneiras particulares.\n\nDe resto, vou fingir que nem li a maioria das coisas que você escreveu para não ter que ficar perdendo meu precioso tempo com jovem alienado.\n\nSó te falo uma coisa: já pensei igual a você um dia, pois já fui maconheiro. Mas o tempo passou, e eu vi o quanto isso me prejudicou, o tanto de merda que eu fiz.\n\nTalvez, um dia você perceba que o buraco é mais embaixo. Num país como o Brasil isso tem tudo para dar muito errado.",Eu sou contra a descriminização das drogas no Brasil,"Maconha é muito menos nociva que cigarro, e também causa muito menos dependência do que a própria nicotina! Não entendo qual problema que a maconha estaria causando lá. Gente com larica fazendo longas filas nos fast food???",Concorda,CONCORDA,"A mensagem atual reforça a posição da mensagem de referência ao argumentar contra a descriminalização das drogas, especificamente da maconha, destacando seus malefícios e o potencial de dar errado no Brasil. O autor da mensagem atual compartilha sua experiência pessoal para validar seu ponto de vista, alinhando-se com a preocupação expressa na mensagem de referência.",drogas
4,6,"Então deveríamos proibir o álcool também, eu já usei de tudo amigo, e tenho 32 anos, eu afirmo sem medo de errar, a maconha é muito menos nociva que o álcool. Vários amigos meus usam maconha diariamente, tem família, filho, trabalham pra caramba e são bem de vida. \n\nAgora pegue um usuário de álcool que bebe todo dia. Ele acaba com a própria vida e a vida de todos que estão em volta. Eu já vi vários casos desses, vários.\n\nQuem fuma um baseado só quer ficar sussegado, não gosta de ir em público, nunca vi um maconheiro arranjar briga. Pode por 100 mil pessoas chapadas no mesmo lugar que duvido que alguem vai arrumar confusão, agora coloca 5 bebados e a confusão está armada.",Eu sou contra a descriminização das drogas no Brasil,"Cigarro causa câncer e infarto, mas não é psicoativo e nem alucinógeno. Maconha acaba com seu cérebro e pode causar diversos problemas degenerativos no sistema nervoso. Ou seja, ambos são muito nocivos de maneiras particulares.\n\nDe resto, vou fingir que nem li a maioria das coisas que você escreveu para não ter que ficar perdendo meu precioso tempo com jovem alienado.\n\nSó te falo uma coisa: já pensei igual a você um dia, pois já fui maconheiro. Mas o tempo passou, e eu vi o quanto isso me prejudicou, o tanto de merda que eu fiz.\n\nTalvez, um dia você perceba que o buraco é mais embaixo. Num país como o Brasil isso tem tudo para dar muito errado.",Discorda,DISCORDA,"A mensagem atual defende a descriminalização da maconha ao compará-la favoravelmente ao álcool, que é legalizado, e ao descrever seus usuários como pacíficos e funcionais, contradizendo a posição da mensagem de referência que é contra a descriminalização das drogas.",drogas
4,7,Álcool não é mais prejudicial que a maconha para o cérebro. Talvez seja para os rins e fígado. E falo isso sabendo o estrago que a maconha causou na minha vida.\n\nO problema maior do álcool reside em o pessoal não levar sua nocividade a sério só por ser legalizado.,Eu sou contra a descriminização das drogas no Brasil,"Então deveríamos proibir o álcool também, eu já usei de tudo amigo, e tenho 32 anos, eu afirmo sem medo de errar, a maconha é muito menos nociva que o álcool. Vários amigos meus usam maconha diariamente, tem família, filho, trabalham pra caramba e são bem de vida. \n\nAgora pegue um usuário de álcool que bebe todo dia. Ele acaba com a própria vida e a vida de todos que estão em volta. Eu já vi vários casos desses, vários.\n\nQuem fuma um baseado só quer ficar sussegado, não gosta de ir em público, nunca vi um maconheiro arranjar briga. Pode por 100 mil pessoas chapadas no mesmo lugar que duvido que alguem vai arrumar confusão, agora coloca 5 bebados e a confusão está armada.",Concorda,CONCORDA,"A mensagem atual, ao argumentar que o álcool não é mais prejudicial que a maconha para o cérebro e reforçar a nocividade da maconha, alinha-se com a posição da mensagem de referência contra a descriminalização das drogas. O autor usa sua experiência pessoal para validar a ideia de que a maconha é prejudicial, o que sustenta a visão de que não deve ser descriminalizada.",drogas
4,8,"Desculpa mas você está enganado. A neurotoxicidade do álcool é incomparável com a da maconha, inclusive sendo uma das causas mais comuns de má formação fetal. Se quer usar \""fatos absolutos\"" pelo menos se informe direito.",Eu sou contra a descriminização das drogas no Brasil,Álcool não é mais prejudicial que a maconha para o cérebro. Talvez seja para os rins e fígado. E falo isso sabendo o estrago que a maconha causou na minha vida.\n\nO problema maior do álcool reside em o pessoal não levar sua nocividade a sério só por ser legalizado.,Outros,OUTROS,"A mensagem atual corrige uma informação sobre a neurotoxicidade do álcool e da maconha, mas não se posiciona diretamente sobre a descriminalização das drogas, que é o tema da mensagem de referência.",drogas
4,9,"https://www.issup.net/knowledge-share/news/2018-11/maconha-mais-prejudicial-para-cerebro-do-que-alcool-diz-novo-estudo\n\nEstudo lá do Canadá, um país sério e com moral para falar. A maconha demora muito mais para sair do organismo do que o Álcool e vicia mais. Os efeitos a longo prazos são mais danosos. Beber dois copos de cerveja em um dia não é o mesmo que fumar dois baseados.\n\nAntes de vir com papinho pedante e petulante, certifique-se que você não é só um massa de manobra que se deixa levar pela \""ciência\"" da agenda progressista. O que eles querem é justamente botar na cabeça das pessoas que maconha não faz tão mal, para não terem que enfrentar resistência ideológica de um bando de zumbi.\n\nVocê repete o mesmo papo que O Globo, Uol e Folha repetiram nos últimos anos, veículos esses sem credibilidade nenhuma, ao mesmo tempo que quer pagar de engajado, kkkk. Assim fica difícil te levar a sério.",Eu sou contra a descriminização das drogas no Brasil,"Desculpa mas você está enganado. A neurotoxicidade do álcool é incomparável com a da maconha, inclusive sendo uma das causas mais comuns de má formação fetal. Se quer usar \""fatos absolutos\"" pelo menos se informe direito.",Concorda,CONCORDA,"A mensagem atual, ao defender a maior nocividade da maconha em comparação ao álcool e criticar a ""agenda progressista"" que minimizaria seus danos, reforça a posição contrária à descriminalização das drogas, alinhando-se à mensagem de referência.",drogas
4,10,"Bom vamos lá. \n\nPrimeiramente, você nem mandou o estudo mas uma matéria sobre o estudo que costuma ser uma péssima forma de se informar. De qualquer modo foz questão de ler o artigo original aqui. Apesar de ter um bom N (amostra), tem diversas limitações quando você quer falar quer uma tem mais neurotoxicidade que a outra, sendo a mais óbvia delas a limitação de faixa etária. \n\nMesmo em adolescentes, temos um viés de ser um estudo em uma região geograficamente e geneticamente pouco diversa. Um problema importante do estudo é não desvencilhar a análise de daily e binge drinkers que conhecidamente tem efeitos muito doferentes a longo prazo (Adolescent binge drinking linked to abnormal spatial working memory brain activation: differential gender effects) (Binge drinking affects attentional and visual working memory processing in young university students).\n\nAlém disso, o estudo preza avaliar unicamente a cognição, ignorando a vasta gama de sintomas relacionados ao uso de álcool como neuropatia (https://www.ncbi.nlm.nih.gov/pmc/articles/PMC3370340/) e sintomas motores da disfunção cerebelar (https://www.sciencedirect.com/science/article/abs/pii/S0987705319303351). Ambos com efeito duradouro e normalmente irreversível.\n\nA realidade é que independente do tipo de abuso de substância, o indivíduo exposto nessa faixa etária usualmente tem um agravo multifatorial por estar menos apoiado socioeconomicamente na maior parte das vezes.\n\nIndependente disso, pegando uma meta análise de 2021, mais recente que o estudo canadense, álcool pareceu ter um efeito maior na cognição de adolescentes em comparação à cannabis (https://www.ncbi.nlm.nih.gov/pmc/articles/PMC8452381/).\n\nPor esse motivo, é mais interessante olharmos dois extremos etários, fetos e idosos. Um pequeno exemplo de um extenso artigo que descreve que diversas substâncias mas define o álcool como a mais impactante no desenvolvimento fetal (https://www.ncbi.nlm.nih.gov/pmc/articles/PMC4262892/). Em relação a demência, o impacto da maconha ainda é ínfimo mesmo com a geração hippie tendo 80 anos atualmente. Isso é visto facilmente buscando o consenso brasileiro de demência que foi atualizado no ano passado no qual o uso de cannabis é meramente citado enquanto o álcool tem padrões muito bem descritos. Ironicamente, se estuda inclusive a utilização de alguns componentes da cannabis para o tratamento da doença de Alzheimer pois é conhecido o efeito neuroprotetor do CBD (https://www.frontiersin.org/articles/10.3389/fneur.2023.1087011/full#:~:text=Cannabidiol%20(CBD)%20has%20numerous%20pharmacological,traumatic%20brain%20injury%20(TBI).) e possivelmente redução da formação de placas beta amiloides relacionadas a patologia DA. Dito isso, o THC parece ter efeito de piora cognitivo e ser o grande responsável pela neurotoxicidade. Mesmo assim, o famoso efeito comitiva ou entourage parece beneficiar até mesmo o THC em baixas doses junto com o CBD e outros terpenos para doenças como epilepsia e a espasticidade na esclerose múltipla que são os principais usos medicinais da cannabis. Seria questionável então a se o uso de quimovares com menores concentrações de THC teriam o mesmo edeito deletério.\n\nPor fim, definitivamente não me informo pela Globo ou afins sensacionalistas, apenas tive esse tom por ser algo óbvio para qualquer pessoa da área que vê no dia a dia o impacto do álcool mesmo que olhando apenas para cognição. Me informo pelos próprios artigos de alto impacto, minha prática clínica como neurologista e como pesquisador na área de cognição em idosos.",Eu sou contra a descriminização das drogas no Brasil,"https://www.issup.net/knowledge-share/news/2018-11/maconha-mais-prejudicial-para-cerebro-do-que-alcool-diz-novo-estudo\n\nEstudo lá do Canadá, um país sério e com moral para falar. A maconha demora muito mais para sair do organismo do que o Álcool e vicia mais. Os efeitos a longo prazos são mais danosos. Beber dois copos de cerveja em um dia não é o mesmo que fumar dois baseados.\n\nAntes de vir com papinho pedante e petulante, certifique-se que você não é só um massa de manobra que se deixa levar pela \""ciência\"" da agenda progressista. O que eles querem é justamente botar na cabeça das pessoas que maconha não faz tão mal, para não terem que enfrentar resistência ideológica de um bando de zumbi.\n\nVocê repete o mesmo papo que O Globo, Uol e Folha repetiram nos últimos anos, veículos esses sem credibilidade nenhuma, ao mesmo tempo que quer pagar de engajado, kkkk. Assim fica difícil te levar a sério.",Discorda,DISCORDA,"A mensagem atual, embora longa e técnica, contradiz a premissa da mensagem de referência ao argumentar que a maconha é menos nociva que o álcool, que é legalizado, e ao apresentar evidências científicas que questionam a neurotoxicidade da maconha em comparação com o álcool, enfraquecendo o argumento contra a descriminalização.",drogas
